{
  "apiVersion": 1,
  "id": "wten-news10",
  "name": "WTEN News10 ABC",
  "homepage": "https://www.news10.com/",
  "feedUrl": "https://www.news10.com/feed",
  "type": "rss",
  "coverage": {
    "country": "US",
    "admin1": "US-NY",
    "admin2": ["Albany County", "Schenectady County", "Rensselaer County", "Saratoga County"],
    "cities": ["Albany", "Schenectady", "Troy", "Saratoga Springs"],
    "metro": "us-ny-capital-region"
  },
  "rightsMode": "RSS_EXCERPT_ALLOWED",
  "language": "en",
  "enabled": true,
  "priority": 80,
  "imageRules": {"allowReuse": false, "requireAttribution": true},
  "notes": "ABC affiliate, Albany. Commercial: excerpts only, no image reuse. Verified live 2026-09-23.",
  "lastVerified": "2026-09-23"
}
