{
  "apiVersion": 1,
  "id": "bbc-world",
  "name": "BBC World",
  "homepage": "https://www.bbc.com/news/world",
  "feedUrl": "https://feeds.bbci.co.uk/news/world/rss.xml",
  "type": "rss",
  "coverage": {"country": "GB"},
  "rightsMode": "RSS_EXCERPT_ALLOWED",
  "language": "en",
  "enabled": true,
  "priority": 50,
  "imageRules": {"allowReuse": false, "requireAttribution": true},
  "notes": "World coverage seed. Commercial: excerpts only, no image reuse. Verified live 2026-09-23.",
  "lastVerified": "2026-09-23"
}
