{
  "apiVersion": 1,
  "id": "nws-albany-alerts",
  "name": "NWS Albany Alerts",
  "homepage": "https://www.weather.gov/aly/",
  "apiUrl": "https://api.weather.gov/alerts/active?point=42.65,-73.75",
  "type": "nws-alerts",
  "coverage": {
    "country": "US",
    "admin1": "US-NY",
    "admin2": ["Albany County", "Schenectady County", "Rensselaer County", "Saratoga County"],
    "cities": ["Albany", "Schenectady", "Troy", "Saratoga Springs"],
    "metro": "us-ny-capital-region"
  },
  "rightsMode": "PUBLIC_DOMAIN",
  "language": "en",
  "enabled": true,
  "priority": 95,
  "imageRules": {"allowReuse": true, "requireAttribution": false},
  "notes": "Federal public-domain weather alerts for the NWS Albany forecast area. Point query covers Albany; Phase 7 polls per-device location on-device. Verified live 2026-09-23.",
  "lastVerified": "2026-09-23"
}
