{
  "apiVersion": 1,
  "id": "city-schenectady-news",
  "name": "City of Schenectady News Flash",
  "homepage": "https://www.cityofschenectady.com/CivicAlerts.aspx",
  "feedUrl": "https://www.cityofschenectady.com/RSSFeed.aspx?ModID=1&CID=All-newsflash.xml",
  "type": "rss",
  "coverage": {
    "country": "US",
    "admin1": "US-NY",
    "admin2": ["Schenectady County"],
    "cities": ["Schenectady"],
    "metro": "us-ny-capital-region"
  },
  "rightsMode": "RSS_EXCERPT_ALLOWED",
  "language": "en",
  "enabled": true,
  "priority": 85,
  "imageRules": {"allowReuse": false, "requireAttribution": true},
  "notes": "Official City of Schenectady news (CivicPlus News Flash). Municipal content: excerpts only, no image reuse. Verified live 2026-09-23.",
  "lastVerified": "2026-09-23"
}
