{
  "apiVersion": 1,
  "id": "city-schenectady-alerts",
  "name": "City of Schenectady Alert Center",
  "homepage": "https://www.cityofschenectady.com/AlertCenter.aspx",
  "feedUrl": "https://www.cityofschenectady.com/RSSFeed.aspx?ModID=63&CID=All-0",
  "type": "rss",
  "coverage": {
    "country": "US",
    "admin1": "US-NY",
    "admin2": ["Schenectady County"],
    "cities": ["Schenectady"],
    "metro": "us-ny-capital-region"
  },
  "rightsMode": "RSS_EXCERPT_ALLOWED",
  "language": "en",
  "enabled": true,
  "priority": 90,
  "imageRules": {"allowReuse": false, "requireAttribution": true},
  "notes": "Official City of Schenectady emergency/public-safety alerts (CivicPlus Alert Center). Municipal content: excerpts only, no image reuse. Verified live 2026-09-23 (no active alerts at seed time).",
  "lastVerified": "2026-09-23"
}
