{
  "apiVersion": 1,
  "id": "usgs-earthquakes",
  "name": "USGS Earthquake Hazards",
  "homepage": "https://earthquake.usgs.gov/",
  "apiUrl": "https://earthquake.usgs.gov/earthquakes/feed/v1.0/summary/4.5_day.geojson",
  "type": "json-api",
  "coverage": {"country": "US"},
  "rightsMode": "PUBLIC_DOMAIN",
  "language": "en",
  "enabled": true,
  "priority": 40,
  "imageRules": {"allowReuse": true, "requireAttribution": false},
  "notes": "Federal public-domain M4.5+ earthquakes, past day. Verified live 2026-09-23.",
  "lastVerified": "2026-09-23"
}
